https://www.reuters.com/article/us-autos-volkswagen-amazon/volkswagen-sees-amazon-built-industrial-cloud-as-future-b2b-marketplace-idUSKCN24O126,['Volkswagen sees Amazon-built ‘industrial cloud’ as future B2B marketplace'],"['July 23, 2020 /  9:20 AM / a day ago']","['(Reuters) - Volkswagen AG (', '), Europe’s largest automaker, is expanding its cloud-based software and data portal, aiming to develop it into an industry-wide marketplace where business customers can buy and sell industrial applications, the company said on Thursday. ', 'VW’s “industrial cloud” was designed in partnership with Amazon Web Services and eventually will link more than 120 VW factories around the world to the automaker’s 1,500 suppliers and their 30,000 plants. ', 'The portal is intended as a place to exchange data and software to help accelerate the digitalization of factory processes from stamping to painting to machinery maintenance, according to Nihar Patel, VW’s executive vice president for strategic core projects. ', 'VW has opened the portal to the first group of supplier partners, led by Siemens AG. Those partners are expected to contribute software applications to be shared with VW and among themselves, in what the automaker described as “an App Store approach.” ', 'Among the initial wave of supplier partners are ABB [ABB.UL], the Swiss industrial automation specialist, and Dürr, the German supplier of automated paint systems and plant engineering services. ', 'AWS will help manage the portal and will provide a range of cloud-based support services, including data analytics and computing, according to Dirk Didascalou, vice president of the Internet of Things at AWS. ', 'VW, the world’s third largest automaker by market capitalization behind Tesla Inc and Toyota Motor Corp, has been working on the industrial cloud for several years with AWS, one of Amazon’s fastest-growing, highest-margin businesses and one that works mainly with corporate customers, from BMW AGand Toyota to Avis Budget Group and Formula One, to manage, analyze and in some cases monetize data. ', 'Patel said VW’s efforts to speed up the ongoing digitalization of its factories has the support of the company’s powerful Works Council and its supervisory board. ', 'Reporting by Paul Lienert in Detroit; Editing by David Gregorio']"
https://www.reuters.com/article/volkswagen-saic/volkswagen-saic-jv-to-revamp-shanghai-plants-to-make-audi-sedans-govt-document-idUSL3N2EK3DK,['Volkswagen-SAIC JV to revamp Shanghai plants to make Audi sedans - govt document'],"['July 14, 2020 /  5:50 AM / 10 days ago']","['BEIJING, July 14 (Reuters) - Volkswagen AG and its Chinese joint venture partner SAIC Motor plan to invest 4.13 billion yuan ($590 million) to revamp their car plants in Shanghai to make new Audi sedans, according to a government document seen by Reuters. ', 'SAIC Volkswagen, the joint venture (JV) of Wolfsburg-based automaker and China’s biggest automaker, currently only sells cars under the Volkswagen and Skoda marques. Audi is Volkswagen’s luxury car unit. ', 'With the revamp at its Shanghai plants, the JV is aiming for an annual manufacturing capacity of 60,000 Audi A7L sedans and 60,000 new Volkswagen sport-utility vehicles. The total capacity at the plants will remain unchanged. ', 'The revamp, expected to be done by the end 2020, comes as demand for luxury cars in China remained firm even as sales in the world’s biggest auto market slumped over the past two years. ', 'SAIC Chairman Chen Hong has previously said the JV plans to roll out the first Audi product in early 2022. ', 'The Audi manufacturing will also use printing facilities at the JV’s newly built MEB platform, a Volkswagen platform that enables efficient production of various electric vehicle models. ', 'Volkswagen hopes to start production based on its MEB platform in Shanghai from the fourth quarter and has sought government nod for production of its electric ID.4 vehicles. ', 'Audi China said its project with SAIC was proceeding according to plan, without giving any more details. SAIC did not immediately reply to a request for comment. ', 'SAIC Volkswagen’s sales fell 37% from a year ago to 577,385 vehicles in the first half of 2020 as the coronavirus pandemic hit demand in China, while total industry sales fell 17%. The JV sold 2 million cars last year. ', 'Audi also has a long-term collaboration with FAW Group in China to build all its cars in the northeastern city of Changchun and southern city of Foshan. ($1 = 7.0055 Chinese yuan) (Reporting by Yilei Sun and Brenda Goh; Editing by Himani Sarkar)']"
https://www.reuters.com/article/us-volkswagen-software/vw-to-shift-centre-of-software-development-to-audi-idUSKCN24F27W,['VW to shift centre of software development to Audi'],"['July 14, 2020 /  4:16 PM / 10 days ago']","['FRANKFURT (Reuters) - Volkswagen (', ') will shift leadership for software development to the company’s premium Audi division in Ingolstadt, Bavaria, Herbert Diess, chief executive of the multi-brand group said on Tuesday. ', '“The centre of gravity for software development will move from Wolfsburg to Ingolstadt,” Diess said at a virtual conference hosted by PWC in Germany on Tuesday.   ', 'Earlier this week German daily Handelsblatt, citing company sources, said Volkswagen is poised to replace its head of software development. ', 'Reporting by Edward Taylor; Editing by Tom Sims']"
https://www.reuters.com/article/us-volkswagen-emissions/u-s-judge-approves-transfer-of-jailed-former-vw-executive-to-germany-idUSKCN24H367,['U.S. judge approves transfer of jailed former VW executive to Germany'],"['July 16, 2020 /  8:25 PM / 8 days ago']","['WASHINGTON/MUNICH (Reuters) - A U.S. judge in Detroit on Thursday approved the transfer to Germany of a former Volkswagen AG (', ') executive imprisoned in the automaker’s diesel emissions scandal. ', 'In 2017, the U.S.-based VW executive Oliver Schmidt, who oversaw emissions issues, was sentenced to seven years in prison and fined $400,000, the maximum possible under a plea deal the German national made with prosecutors after admitting to charges of conspiring to mislead U.S regulators and violate clean-air laws. ', 'Schmidt, now 51, was not scheduled to be released from a U.S. prison until December 2022. Under the terms of his transfer approved by Judge Elizabeth Stafford, Germany will assume responsibility for enforcing the remainder of his sentence. ', 'The Justice Department declined to comment.  ', 'A half-dozen former VW executives charged by U.S. prosecutors are believed to still be in Germany, including former Volkswagen boss Martin Winterkorn. ', 'Winterkorn was also charged by German prosecutors in 2019 with stock market manipulation. ', 'Germany’s Federal Justice Ministry has said it does not extradite German nationals to countries outside the European Union. ', 'In total, nine people have been charged by U.S. prosecutors and two former VW executives who have pleaded guilty in the case were sentenced to prison terms, including Schmidt. ', 'Volkswagen has admitted to using illegal software to cheat U.S. pollution tests in 2015, allowing up to 40 times legally allowable emissions and in 2017 pleaded guilty to fraud, obstruction of justice and falsifying statements as part of a $4.3 billion settlement reached with the Justice Department. ', 'The scandal triggered a global backlash against diesel vehicles that has so far cost VW 30 billion euros ($33.3 billion) in fines, penalties and vehicle buyback costs. ', 'Last month, a U.S. appeals court ruled VW cannot escape potential financial penalties stemming from lawsuits filed by two counties that may amount to a “staggering” additional liability. ', 'Reporting by David Shepardson in Washington and Joern Poltz in Munich; Editing by Chris Reese and Jonathan Oatis']"
https://www.reuters.com/article/volkswagen-emissions/u-s-judge-approves-transfer-of-jailed-former-vw-executive-to-germany-idUSL2N2EN2A3,['U.S. judge approves transfer of jailed former VW executive to Germany'],"['July 16, 2020 /  8:13 PM / 8 days ago']","['WASHINGTON/MUNICH, July 16 (Reuters) - A U.S. judge in Detroit on Thursday approved the transfer to Germany of a former Volkswagen AG executive imprisoned in the automaker’s diesel emissions scandal. ', 'In 2017, the U.S.-based VW executive Oliver Schmidt, who oversaw emissions issues, was sentenced to seven years in prison and fined $400,000, the maximum possible under a plea deal the German national made with prosecutors after admitting to charges of conspiring to mislead U.S regulators and violate clean-air laws. ', 'Schmidt, now 51, was not scheduled to be released from a U.S. prison until December 2022. Under the terms of his transfer, Germany will assume responsibility for enforcing the remainder of his sentence. (Reporting by David Shepardson in Washington and Joern Poltz in Munich Editing by Chris Reese)']"
https://www.reuters.com/article/autos-batteries-southkorea/volkswagen-warns-korean-battery-row-could-lead-to-catastrophic-supply-disruption-idUSL3N2ES1TP,"['Volkswagen warns Korean battery row could lead to ""catastrophic"" supply disruption']","['July 21, 2020 /  8:05 AM / 3 days ago']","['SEOUL, July 21 (Reuters) - Volkswagen and Ford said a U.S. legal row between South Korean battery makers could disrupt supplies of the key electric vehicle parts and cost U.S. jobs during the Covid-19 outbreak, according to documents submitted to a U.S. trade panel. ', 'The two automakers asked the United States International Trade Commission (ITC) to allow SK Innovation to manufacture batteries at its proposed U.S. factory in Georgia for use in Ford’s fully electric F-150 and other electric cars, the statements seen by Reuters showed. ', 'Last year, South Korean battery maker LG Chem sued small rival SK Innovation over alleged trade secret theft in the United States, seeking to bar SK from producing battery cells in the U.S. and importing the components necessary to make the cells. ', '“Any remedial orders should seek to avoid collateral damage to SKI’s existing customers,” Volkswagen said in its public interest comments to the ITC in May. ', '“To avoid a catastrophic supply disruption,” the commission should allow SK Innovation to manufacture EV batteries in the U.S. facility, Volkswagen said in the May statement. ', 'Ford said that LG Chem’s assertion that it can replace SK Innovation as a supplier is not “credible” given EV battery supply shortages and the long development period required for EVs. ', 'LG Chem declined to comment, citing ongoing litigation. ', 'SK Innovation is building its first battery plant in Georgia to serve Volkswagen’s EV base in neighboring Tennessee starting 2022. SK Innovation also plans to add a second U.S. plant to supply Ford’s electric pickup trucks and other models. ', '“The risk to such U.S. jobs is especially unacceptable in light of current economic conditions caused by COVID-19,” Ford said in its public interest comments to the ITC. ', 'This year, the ITC preliminarily ruled in favor of LG Chem, dealing a blow to SK Innovation. The ITC is set to make a final ruling in the case on Oct. 5. (Reporting by Hyunjoo Jin Editing by Shri Navaratnam)']"
