https://www.reuters.com/article/us-france-renault-jobs/renault-to-cut-1500-engineering-jobs-in-france-union-source-idUSKBN23N1SP,"['Renault to cut 1,500 engineering jobs in France: union source']","['June 16, 2020 /  11:40 AM / a month ago']","['PARIS (Reuters) - French carmaker Renault (', ') plans to cut 1,500 engineering jobs in France, a trade union source told Reuters on Tuesday. ', 'The engineering job cuts are part of cost savings plans that Renault announced last month aiming to find 2 billion euros ($2.27 billion) in savings over the next three years. ', 'Renault declined to comment. ', 'The carmaker had planned to cut 15,000 jobs worldwide, including 4,600 in France. ', 'Renault shares were up 5.66% at 1118 GMT. ', 'Reporting by Gilles Guillaume; writing by Matthieu Protard; editing by Jason Neely']"
https://www.reuters.com/article/us-renault-agm/renault-has-not-asked-eus-carbon-reduction-goals-to-be-pushed-back-chairman-idUSKBN23Q2D1,"[""Renault has not asked EU's carbon reduction goals to be pushed back: Chairman""]","['June 19, 2020 /  1:48 PM / a month ago']","['PARIS (Reuters) - French carmaker Renault (', ') has not asked for European Union’s stringent carbon emission reduction goals to be pushed back in spite of the coronavirus crisis, Chairman Jean-Dominique Senard said on Friday.  ', 'Senard, who was speaking at a shareholder meeting, added that the company aimed to increase production of electric vehicles in France fourfold by 2024. ', 'Reporting by Sarah White and Gilles Guillaume; Writing by Mathieu Rosemain; Editing by Louise Heavens']"
https://www.reuters.com/article/us-renault-strategy-nissan/renaults-senard-says-relations-with-nissan-much-improved-idUSKBN23I17U,"[""Renault's Senard says relations with Nissan much improved""]","['June 11, 2020 /  8:59 AM / 2 months ago']","['PARIS (Reuters) - Renault (', ')’s partnership with Japan’s Nissan (', ') has entered an “incredibly positive” phase after episodes of strained relations in recent years, the French carmaker’s chairman Jean-Dominique Senard said on Thursday.  ', '“We’ve put the work in, we’re in an incredibly positive dynamic,” Senard told a hearing in France’s lower house of parliament, after Renault and Nissan presented plans to deepen their collaboration in May.  ', 'Senard added that Renault was confident that car sales, which have ground to a halt during the coronavirus pandemic and ensuing lockdowns, would pick up again in France in the coming months.  ', 'Reporting by Gilles Guillaume and Sarah White; editing by Jason Neely']"
https://www.reuters.com/article/us-renault-strategy-capital/renault-nationalisation-state-cash-injection-not-on-the-table-chairman-idUSKBN23I1GR,"['Renault nationalisation, state cash injection not on the table: chairman']","['June 11, 2020 /  10:13 AM / 2 months ago']","['PARIS (Reuters) - A further investment by the French government in Renault’s (', ') capital would not be the most pertinent or useful use of state resources, the carmaker’s chairman said on Thursday, adding that nationalisation of the firm was not being contemplated.  ', '“I’ve said that it isn’t on the table,” Jean-Dominique Senard told a hearing in the lower house of the French parliament. “I have nothing against the state, I’m just saying that it’s not useful to spend taxpayer money to invest it in a company which needs to find its own resources.” ', 'Renault is 15% owned by the French government. It tapped state aid to help cope with the coronavirus pandemic via a 5 billion euro ($5.69 billion) state-guaranteed loan. ', 'Reporting by Gilles Guillaume and Sarah White; editing by Jason Neely']"
https://www.reuters.com/article/renault-france/renault-finalises-5-billion-euros-credit-facility-with-french-state-idUSASN0007JF,['Renault finalises 5 billion euros credit facility with French state'],"['June 3, 2020 /  6:32 AM / 2 months ago']","['PARIS, June 3 (Reuters) - Carmaker Renault finalised on Wednesday a 5 billion euros ($5.60 billion) credit facility with the French government, strengthening Renault’s finances in the wake of the coronavirus pandemic which has ravaged the autos industry. ', 'Renault said that the new credit facility carried a guarantee from the French state - which owns a 15% stake in Renault - of up to 90% of the total amount borrowed. ', 'Banks BNP Paribas, Credit Agricole, HSBC France, Natixis and SocGen were involved in the new Renault credit deal. ', '$1 = 0.8925 euros\nReporting by Sudip Kar-Gupta\nEditing by Keith Weir']"
https://www.reuters.com/article/europe-stocks/corrected-european-shares-rise-on-upbeat-china-data-renault-jumps-idUSL4N2DG1PK,['CORRECTED-European shares rise on upbeat China data; Renault jumps'],"['June 3, 2020 /  7:22 AM / 2 months ago']","['(Corrects time to “0800 GMT” from “0900 GMT” in paragraph 4) ', 'June 3 (Reuters) - European shares joined a global rally on Wednesday as signs of a pickup in China’s services activity offset concerns about Sino-U.S. trade tensions and widespread civil unrest in the United States. ', 'The pan-European STOXX 600 rose 0.8% by 0714 GMT, holding near a three-month high. ', 'Sectors exposed to the health of China’s economy such as oil & gas and automakers rose more than 1% after a survey showed China’s services sector returned to growth in May for the first time since January, even though employment and overseas demand remained weak. ', 'Final data on euro zone business activity for May is due at 0800 GMT. ', 'Among individual stocks, Renault SA jumped 7.7% after it finalised a 5 billion euro ($5.60 billion) loan from with the French government and Goldman Sachs upgraded its stock to “buy”. ', 'French insurer AXA rose 5% after revealing plans to halve its dividend amid the coronavirus crisis, while adding that it could propose an additional fourth-quarter shareholder payment if conditions improved. (Reporting by Sruthi Shankar in Bengaluru; Editing by Arun Koyyur)']"
https://www.reuters.com/article/us-france-autos-renault/renault-sees-june-recovery-in-french-car-sales-stretching-into-third-quarter-idUSKBN2424WH,['Renault sees June recovery in French car sales stretching into third quarter'],"['July 1, 2020 /  8:16 AM / a month ago']","['PARIS (Reuters) - Renault (', ') expects a pick-up in the French car market in June, after the country’s coronavirus lockdown was lifted, to carry on into the third quarter, the brand’s sales chief for France Ivan Segal said on Wednesday.  ', 'New car registrations in France were up 1.24% year-on-year in June, their first rise this year and following a deep slump in May, when dealerships were closed.  ', 'Renault in particular benefited from a recovery, with its June registrations increasing by 6.51% in France, though Peugeot maker PSA (', ') recorded a 9.14% year-on-year decline.  ', 'Segal told reporters there was still uncertainty about the state of the market in the fourth quarter, however, while the brand is expecting the French car market to fall by 20% this year as a whole.  ', 'Reporting by Gilles Guillaume; Writing by Sarah White; Editing by Sudip Kar-Gupta']"
https://www.reuters.com/article/us-motor-f1-renault/motor-racing-renault-retain-sirotkin-as-f1-reserve-idUSKBN2411RF,['Motor racing: Renault retain Sirotkin as F1 reserve'],"['June 30, 2020 /  11:37 AM / a month ago']","['LONDON (Reuters) - Russian Sergey Sirotkin will be on standby in Austria this weekend after Renault announced on Tuesday they had retained him as their Formula One reserve driver. ', 'The role has come into the spotlight more as the sport finally starts its season amid the COVID-19 pandemic, with the possibility of drivers being ruled out by the virus. ', 'Sirotkin, 24, raced for Williams in 2018 and filled the Renault reserve role in 2017 and 2019. Renault’s race drivers are Australian Daniel Ricciardo and Frenchman Esteban Ocon. ', '“I understand the importance for a team to have a driver ready to fill in quickly should the opportunity arise, especially given the current situation the world is in,” Sirotkin said in a statement. ', '“I’ve been keeping sharp and focused, and I would be well-prepared to race a Formula One car again.” ', 'Sirotkin doubled up as McLaren reserve last season but that team, who are switching to Mercedes power in 2021, will share  back-up drivers Stoffel Vandoorne and Esteban Gutierrez with Mercedes and Racing Point. ', 'Reporting by Alan Baldwin; Editing by Hugh Lawson']"
https://www.reuters.com/article/us-ecb-policy-credit/as-the-ecb-ponders-purchases-bond-angels-arent-falling-idUSKBN23O1RY,"[""As the ECB ponders purchases, bond angels aren't falling""]","['June 17, 2020 /  11:35 AM / a month ago']","['FRANKFURT (Reuters) - An expected wave of credit rating cuts for companies as a result of the coronavirus crisis has yet to materialise, data shows, meaning speculation that the European Central Bank will buy bonds of “fallen angels” downgraded to junk may be premature.   ', 'The ECB has warned there is “considerable risk of imminent downgrades” for euro zone corporate bonds, many of which could be pushed into the speculative grade or “junk” category.  ', 'That would force large investors such as insurance and pension funds, which are largely restricted to investment-grade assets, to sell any bonds they hold, hitting prices and hampering companies’ ability to refinance debt. ', 'Sources have told Reuters ECB staff are considering whether to add recently downgraded bonds to its 1.35 trillion euro ($1.52 trillion) emergency stimulus programme, as the Federal Reserve has done to help support the U.S. economy.  ', 'But Refinitiv data compiled by Reuters shows only three companies that qualify for ECB purchases have lost their investment-grade status since April 7 — French auto-maker Renault (', '), German airline Lufthansa (', ') and Berlin-based real-estate group Ado Properties (', ').   ', 'The ECB currently accepts debt downgraded to junk after April 7 as collateral when lending to banks, and that date could mark a cut-off point if it decides to add junk-rated debt to its Corporate Sector Purchase Programme.       ', 'Even going back to mid-March, when coronavirus lockdowns began, would add only two issuers, German car-parts maker ZF Friedrichshafen and Italian retailer Esselunga. ', '“This measure (buying “fallen angel” debt) would be very controversial and only affect a few names to date, which are all protected by the collateral backstop, so I don’t expect it will be introduced,” said Marco Brancolini, a strategist at Nomura. ', 'The ECB does not have to sell downgraded debt it already owns but cannot buy new bonds from issuers that do not have at least one investment-grade rating from S&P Global, Moody’s, Fitch or DBRS. ', 'Adding up all the bonds downgraded since March 22 gives  total debt outstanding of 9.275 billion euros ($10.45 billion) — less than 5% of the 212 billion euros’ worth of corporate bonds held by the ECB. ', 'The Fed is already buying junk bonds, with a backstop from the U.S. Treasury which would bear the first losses. ', 'Isabel Schnabel, the ECB board member in charge of the asset purchase programme, has said that mechanism would be difficult to replicate in the 19-country euro zone. ', 'Downgrades could come with a delay and in waves, as happened after the global financial crisis that began in 2007. If that pattern is repeated, the ECB estimates a nominal 110 billion euros of bonds could be downgraded to junk over the next year. ', 'Some, however, see rating agencies as more cautious this time around. ', '“Only Fitch has been aggressive so far, but it now seems to have slightly softened its reaction function while Moody’s, S&P and DBRS have taken a decidedly wait-and-see approach,” Nomura’s Brancolini said. ', 'Reporting by Francesco Canepa; Editing by Catherine Evans']"
https://www.reuters.com/article/us-renault-france/renault-finalises-5-billion-euro-state-backed-loan-idUSKBN23A0RS,['Renault finalises 5 billion euro state-backed loan'],"['June 3, 2020 /  6:34 AM / 2 months ago']","['PARIS (Reuters) - Renault (', ') finalised on Wednesday a 5 billion euro ($5.60 billion) loan from with the French government, strengthening the carmaker’s finances in the wake of the coronavirus pandemic which has ravaged the auto industry. ', 'Renault said that the credit facility carried a guarantee from the French state - which owns a 15% stake in Renault - of up to 90% of the total amount borrowed. ', 'Banks BNP Paribas (', '), Credit Agricole (', '), HSBC France (', '), Natixis (', ') and SocGen (', ') were involved in the credit deal. ', 'Renault also said in a statement that the loan would help finance the company’s liquidity requirements. ', 'The carmaker announced last week plans to cut about 15,000 jobs worldwide, including 4,600 in France, where the company will seek voluntary departures and use retirement schemes. ', 'The announcement sparked weekend protests at some factories, including at Maubeuge in northern France, although Renault’s chairman Jean-Dominique Senard has pledged the site will not be closed. ', ' ($1 = 0.8925 euros) ', 'Reporting by Sudip Kar-Gupta and Matthieu Protard; Editing by Keith Weir and Louise Heavens']"
https://www.reuters.com/article/motor-f1-styria/update-1-motor-racing-racing-point-parts-impounded-after-renault-protest-idUSL5N2EJ0J9,['UPDATE 1-Motor racing-Racing Point parts impounded after Renault protest'],"['July 12, 2020 /  7:33 PM / 16 days ago']","['(Adds stewards ruling the protest is admissible) ', 'SPIELBERG, Austria, July 12 (Reuters) - Formula One’s governing body impounded brake ducts from the Racing Point cars on Sunday after Styrian Grand Prix stewards ruled a Renault protest met the requirements for further investigation. ', 'Renault had questioned the legality of parts on the ‘Pink Mercedes’ cars after their rivals’ strong showing in Sunday’s second round of the season at Austria’s Red Bull Ring. ', 'Mexican Sergio Perez finished sixth and Canadian Lance Stroll, son of team owner Lawrence, seventh. Renault’s Australian Daniel Ricciardo ended up eighth. ', 'The alleged breach concerns the design and outsourcing of listed parts. ', 'Stewards said in a statement that the governing FIA’s technical department would seal and impound the front and rear brake ducts for detailed analysis. ', 'Champions Mercedes, who provide Racing Point’s engine and gearbox, were also ordered to hand over the brake ducts used on their car last season for comparison. ', 'No date was set for the next meeting, but Formula One is racing again in Hungary on July 19. ', 'Racing Point have freely recognised their car is a close copy of last year’s title-winning Mercedes but within the regulations. ', '“I don’t think what we’ve done is particularly new as far as taking a team’s concept and doing it ourselves. That’s been prolific in Formula One since the very first days,” technical director Andy Green said back in testing in February. ', 'Renault and Racing Point, formerly known as Force India, have clashed before over the regulations with the French team stripped of points from the Japanese Grand Prix after a protest by the Silverstone-based outfit. ', 'Racing Point had successfully protested against the brake bias system used by Renault. ', 'Renault finished last season fifth overall, with Racing Point seventh. Racing Point are currently fourth with 22 points while Renault are sixth on eight. (Reporting by Alan Baldwin in London; Editing by Christian Radnedge and Hugh Lawson)']"
https://www.reuters.com/article/us-renault-sales/renaults-first-half-vehicle-sales-down-34-9-zoe-electric-model-shines-idUSKCN24L0PZ,"[""Renault's first half vehicle sales down 34.9%, ZOE electric model shines""]","['July 20, 2020 /  7:45 AM / 9 days ago']","['PARIS (Reuters) - French carmaker Renault (', ') on Monday reported a 34.9% drop in worldwide vehicle sales in the first half of the year due to the impact from the new coronavirus outbreak but said it had seen some signs of recovery in June.  ', 'Sales of its ZOE electric model were up by nearly 50%. ', 'Renault said the overall decline was mainly due to its high exposure to countries that have imposed strict lockdowns. ', 'Reporting by Gilles Guillaume; writing by Matthieu Protard; editing by Jason Neely']"
https://www.reuters.com/article/us-renault-france-strategy/we-thought-too-big-renault-says-as-it-axes-15000-jobs-in-cost-cutting-reboot-idUSKBN2350K0,"['We thought too big, Renault says as it axes 15,000 jobs in cost-cutting reboot']","['May 29, 2020 /  5:35 AM / 2 months ago']","['PARIS (Reuters) - Renault acknowledged that its global ambitions had been unrealistic, announcing plans to cut about 15,000 jobs, shrink production and restructure French plants as it pressed the reset button and sought to banish the spectre of Carlos Ghosn. ', 'Faced with a slump in demand that has been exacerbated by the coronavirus pandemic, the French carmaker detailed plans on Friday to find 2 billion euros ($2.22 billion) in savings over the next three years. ', '“We thought too big in terms of sales,” said interim Chief Executive Clotilde Delbos, adding the company was “coming back to its bases” after investing and spending too much in recent years. ', 'Renault was under pressure even before COVID-19 hit, posting its first loss in a decade in 2019, and has said nothing would be “taboo” as it reviews its business.      ', 'It plans to trim its global capacity to 3.3 million vehicles in 2024 from 4 million now, focusing on its most profitable models and areas such as electric cars while freezing manufacturing expansion in countries like Romania. ', 'Renault, like its Japanese alliance partner Nissan, is rowing back on an aggressive expansion plan pursued by Ghosn, its former boss-turned-fugitive, who is wanted on charges of financial misconduct in Tokyo. Ghosn denies the charges.  ', '“The mindset has completely changed. The previous line was volumes and sales and being the first on the podium,” Delbos said. “We’re not looking to be on top of the world, what we want is a sustainable and profitable company.” ', 'The company, due to bring ex-Volkswagen (', ') executive Luca de Meo on board as CEO in July, said it would cut costs by reducing the number of subcontractors in areas such as engineering and the number of components it uses, as well as shrinking gearbox manufacturing worldwide. ', 'Delbos ruled out the need for a rights issue, saying Renault was close to sealing a 5 billion-euro credit line guaranteed by the French government. ', 'Renault shares were down 5.3% by 1223 GMT, the worst-performing stock on France’s blue-chip index.   ', 'Renault, which is 15% owned by the French state, faces the most sensitive restructuring measures in its home country, which will shoulder almost a third of the global job cuts and faces potential plant closures. ', 'The carmaker said it was in talks with unions. Six sites out of Renault’s 14 plants in France - including a component factory in Brittany and the Dieppe factory where the group’s Alpine cars are made - will be under review, though most changes would take effect after 2022, Delbos said.  ', 'Some of the six plants like the one in Flins, close to Paris, where it makes its electric Zoe models, could cease to assemble cars and centre on recycling activities instead, the company said.  ', 'The government has said it will not sign off on the state-backed loan until management and unions conclude talks over jobs and factories in France. It is seeking more clarity on how some big factories will be reorganised and further guarantees on jobs before it gives the green light, according to a source familiar with the matter.  ', 'In all, just under 10% of Renault’s global workforce will be affected by layoffs, and restructuring measures will cost 1.2 billion euros. There will be about 4,600 job cuts in France, though Renault said it would prioritise employment transfers, voluntary departures and retirement schemes.  ', 'French unions expressed frustration. ', '“This plan is unbalanced, at the expense of French activities,” the moderate CFDT union said on Friday, adding that other countries had been less affected.  ', 'Renault is still struggling to move on from the scandal involving Ghosn, which strained its relations with alliance partner Nissan and paralysed joint projects. ', 'Ghosn, who ran Renault and was the chief architect of the alliance, was arrested in Japan in late 2018 on financial misconduct charges, but fled to Lebanon in December last year. He has denied wrongdoing and hit out at his past employers. ', 'Renault and Nissan have been hit hard by the pandemic just as they were trying to rework their partnership. Nissan this week also outlined a plan to become smaller and more efficient. ', 'The pair were among the weakest global automakers going into the crisis, lacking a clear plan for using their alliance to emerge from the slump and share the burden of investing in electric vehicles and other technology. ', 'Germany’s BMW also confirmed on Friday that it was in talks with its works council over job cuts, but declined to provide concrete figures. News agency dpa reported the carmaker plans to slash around 6,000 jobs, 4.8% of the carmaker’s total. ', '($1 = 0.9016 euros) ', 'Reporting by Gilles Guillaume and Sarah White; Additional reporting by Jan Schwartz and Christoph Steitz; Editing by Jason Neely and Pravin Char']"
https://www.reuters.com/article/renault-ceo/incoming-renault-ceo-flags-turnaround-challenge-idUSP6N29101D,['Incoming Renault CEO flags turnaround challenge'],"['June 19, 2020 /  2:42 PM / a month ago']","['PARIS, June 19 (Reuters) - Renault’s incoming Chief Executive Luca de Meo said on Friday he was conscious the French carmaker faced many problems, but added he was confident the group could end up becoming a positive turnaround story. ', 'De Meo, addressing investors at the firm’s annual shareholder meeting before taking up his new job on July 1, said he shared a “sense of urgency” with teams at Renault to deliver on its new strategy and restructuring. ', '“I’m very conscious of the company’s difficulties,” said De Meo, a former Volkswagen executive, adding he had been keen to join the company for the challenge. (Reporting by Gilles Guillaume and Sarah White Editing by Mathieu Rosemain)']"
https://www.reuters.com/article/renault-france-senard/renaults-state-backed-loan-carries-no-major-conditions-says-chairman-idUSP6N2D206L,"[""Renault's state-backed loan carries no major conditions, says chairman""]","['June 2, 2020 /  4:07 PM / 2 months ago']","['PARIS, June 2 (Reuters) - French carmaker Renault’s chairman, Jean-Dominique Senard, on Tuesday said that the 5 billion euro ($5.6 billion) state-backed loan due to granted by the government comes without any major conditions. ', 'Senard also told franceinfo radio that the company aims to present a new strategic plan, including the vision for its brands, by the end of the year after a new CEO comes on board. ', 'Renault last week unveiled plans to cut about 15,000 jobs, shrink production and restructure French plants. ($1 = 0.8953 euros) (Reporting by Sarah White Writing by Matthieu Protard Editing by David Goodman )']"
https://www.reuters.com/article/us-renault-france-restructuring/renault-chairman-dismisses-fears-over-potential-maubeuge-closure-idUSKBN2370GZ,['Renault chairman dismisses fears over potential Maubeuge closure'],"['May 31, 2020 /  2:12 PM / 2 months ago']","['PARIS (Reuters) - Renault (', ') has no plans to close its Maubeuge plant in northern France, Chairman Jean-Dominique Senard said on Sunday, two days after the carmaker announced 15,000 job cuts globally as part of a major restructuring. ', 'The recovery plan, which would eliminate 4,600 jobs in France, aims to consolidate the Maubeuge site’s vehicle production with that of the nearby Douai plant.  ', '“I have no intention of closing the Maubeuge factory,” Senard said on LCI television on Sunday after thousands of employees and family members demonstrated outside the plant the previous day. ', 'Under the proposals unveiled on Friday, a parts reconditioning center in Choisy-le-Roi, south of Paris, is the only facility earmarked for outright closure. ', 'The carmaker’s Caudan parts foundry in Brittany, western France, could also be sold as part of the restructuring, Senard said on Sunday. The plant is one of six that Renault has placed under strategic review. ', 'Reporting by Gwenaelle Barzic; Writing by Laurence Frost; Editing by David Goodman']"
